0.000000 0.000000 IP 192.168.10.216.50166 > 192.168.10.17.24: Flags [S], seq 1217850782, win 64240, options [mss 1460,sackOK,TS val 1664074798 ecr 0,nop,wscale 9], length 0
0.000219 0.000219 IP 192.168.10.17.24 > 192.168.10.216.50166: Flags [S.], seq 75765578, ack 1217850783, win 1024, options [mss 1460], length 0
0.000354 0.000135 IP 192.168.10.216.50166 > 192.168.10.17.24: Flags [.], ack 1, win 64240, length 0
0.000460 0.000106 readn() start (0 bytes in rcvbuf)
0.000528 0.000068 IP 192.168.10.17.24 > 192.168.10.216.50166: Flags [.], seq 1:10221, ack 1, win 62615, length 10220
0.000537 0.000009 ---> read in readn start
0.000588 0.000051 IP 192.168.10.216.50166 > 192.168.10.17.24: Flags [.], ack 10221, win 65535, length 0
0.000599 0.000011 IP 192.168.10.17.24 > 192.168.10.216.50166: Flags [.], seq 10221:18981, ack 1, win 62615, length 8760
0.000634 0.000035 IP 192.168.10.216.50166 > 192.168.10.17.24: Flags [.], ack 18981, win 65535, length 0
0.000655 0.000021 ---> read in readn done (18980 bytes read)
0.000658 0.000003 ---> read in readn start
0.000835 0.000177 IP 192.168.10.17.24 > 192.168.10.216.50166: Flags [.], seq 18981:46721, ack 1, win 62615, length 27740
0.000887 0.000052 IP 192.168.10.216.50166 > 192.168.10.17.24: Flags [.], ack 46721, win 65535, length 0
0.000950 0.000063 IP 192.168.10.17.24 > 192.168.10.216.50166: Flags [.], seq 46721:51101, ack 1, win 62615, length 4380
0.001069 0.000119 IP 192.168.10.216.50166 > 192.168.10.17.24: Flags [.], ack 51101, win 65535, length 0
0.001085 0.000016 IP 192.168.10.17.24 > 192.168.10.216.50166: Flags [.], seq 51101:64241, ack 1, win 62615, length 13140
0.001104 0.000019 IP 192.168.10.216.50166 > 192.168.10.17.24: Flags [.], ack 64241, win 65535, length 0
0.001138 0.000034 ---> read in readn done (45260 bytes read)
0.001146 0.000008 ---> read in readn start
0.001206 0.000060 IP 192.168.10.17.24 > 192.168.10.216.50166: Flags [.], seq 64241:78841, ack 1, win 62615, length 14600
0.001230 0.000024 IP 192.168.10.216.50166 > 192.168.10.17.24: Flags [.], ack 78841, win 65535, length 0
0.001265 0.000035 ---> read in readn done (14600 bytes read)
0.001266 0.000001 ---> read in readn start
0.001345 0.000079 IP 192.168.10.17.24 > 192.168.10.216.50166: Flags [.], seq 78841:94901, ack 1, win 62615, length 16060
0.001364 0.000019 IP 192.168.10.216.50166 > 192.168.10.17.24: Flags [.], ack 94901, win 65535, length 0
0.001450 0.000086 ---> read in readn done (16060 bytes read)
0.001456 0.000006 ---> read in readn start
0.001523 0.000067 IP 192.168.10.17.24 > 192.168.10.216.50166: Flags [.], seq 94901:115341, ack 1, win 62615, length 20440
0.001564 0.000041 IP 192.168.10.216.50166 > 192.168.10.17.24: Flags [.], ack 115341, win 65535, length 0
0.001662 0.000098 ---> read in readn done (20440 bytes read)
0.001668 0.000006 ---> read in readn start
0.001697 0.000029 IP 192.168.10.17.24 > 192.168.10.216.50166: Flags [.], seq 115341:132861, ack 1, win 62615, length 17520
0.001715 0.000018 IP 192.168.10.216.50166 > 192.168.10.17.24: Flags [.], ack 132861, win 65535, length 0
0.001747 0.000032 ---> read in readn done (17520 bytes read)
0.001748 0.000001 ---> read in readn start
0.001798 0.000050 IP 192.168.10.17.24 > 192.168.10.216.50166: Flags [.], seq 132861:146001, ack 1, win 62615, length 13140
0.001811 0.000013 IP 192.168.10.216.50166 > 192.168.10.17.24: Flags [.], ack 146001, win 65535, length 0
0.001836 0.000025 ---> read in readn done (13140 bytes read)
0.001837 0.000001 ---> read in readn start
0.001920 0.000083 IP 192.168.10.17.24 > 192.168.10.216.50166: Flags [.], seq 146001:160601, ack 1, win 62615, length 14600
0.001932 0.000012 IP 192.168.10.216.50166 > 192.168.10.17.24: Flags [.], ack 160601, win 65535, length 0
0.001960 0.000028 ---> read in readn done (14600 bytes read)
0.001961 0.000001 ---> read in readn start
0.002038 0.000077 IP 192.168.10.17.24 > 192.168.10.216.50166: Flags [.], seq 160601:173741, ack 1, win 62615, length 13140
0.002049 0.000011 IP 192.168.10.216.50166 > 192.168.10.17.24: Flags [.], ack 173741, win 65535, length 0
0.002078 0.000029 ---> read in readn done (13140 bytes read)
0.002079 0.000001 ---> read in readn start
0.002170 0.000091 IP 192.168.10.17.24 > 192.168.10.216.50166: Flags [.], seq 173741:189801, ack 1, win 62615, length 16060
0.002181 0.000011 IP 192.168.10.216.50166 > 192.168.10.17.24: Flags [.], ack 189801, win 65535, length 0
0.002209 0.000028 ---> read in readn done (16060 bytes read)
0.002210 0.000001 ---> read in readn start
0.002277 0.000067 IP 192.168.10.17.24 > 192.168.10.216.50166: Flags [.], seq 189801:202941, ack 1, win 62615, length 13140
0.002303 0.000026 IP 192.168.10.216.50166 > 192.168.10.17.24: Flags [.], ack 202941, win 65535, length 0
0.002328 0.000025 ---> read in readn done (13140 bytes read)
0.002329 0.000001 ---> read in readn start
0.002400 0.000071 IP 192.168.10.17.24 > 192.168.10.216.50166: Flags [.], seq 202941:217541, ack 1, win 62615, length 14600
0.002413 0.000013 IP 192.168.10.216.50166 > 192.168.10.17.24: Flags [.], ack 217541, win 65535, length 0
0.002441 0.000028 ---> read in readn done (14600 bytes read)
0.002442 0.000001 ---> read in readn start
0.002527 0.000085 IP 192.168.10.17.24 > 192.168.10.216.50166: Flags [.], seq 217541:232141, ack 1, win 62615, length 14600
0.002538 0.000011 IP 192.168.10.216.50166 > 192.168.10.17.24: Flags [.], ack 232141, win 65535, length 0
0.002567 0.000029 ---> read in readn done (14600 bytes read)
0.002567 0.000000 ---> read in readn start
0.002637 0.000070 IP 192.168.10.17.24 > 192.168.10.216.50166: Flags [.], seq 232141:245281, ack 1, win 62615, length 13140
0.002650 0.000013 IP 192.168.10.216.50166 > 192.168.10.17.24: Flags [.], ack 245281, win 65535, length 0
0.002675 0.000025 ---> read in readn done (13140 bytes read)
0.002675 0.000000 ---> read in readn start
0.002758 0.000083 IP 192.168.10.17.24 > 192.168.10.216.50166: Flags [.], seq 245281:259881, ack 1, win 62615, length 14600
0.002769 0.000011 IP 192.168.10.216.50166 > 192.168.10.17.24: Flags [.], ack 259881, win 65535, length 0
0.002812 0.000043 ---> read in readn done (14600 bytes read)
0.002813 0.000001 ---> read in readn start
0.002887 0.000074 IP 192.168.10.17.24 > 192.168.10.216.50166: Flags [.], seq 259881:274481, ack 1, win 62615, length 14600
0.002900 0.000013 IP 192.168.10.216.50166 > 192.168.10.17.24: Flags [.], ack 274481, win 65535, length 0
0.002928 0.000028 ---> read in readn done (14600 bytes read)
0.002929 0.000001 ---> read in readn start
0.003000 0.000071 IP 192.168.10.17.24 > 192.168.10.216.50166: Flags [.], seq 274481:287621, ack 1, win 62615, length 13140
0.003011 0.000011 IP 192.168.10.216.50166 > 192.168.10.17.24: Flags [.], ack 287621, win 65535, length 0
0.003034 0.000023 ---> read in readn done (13140 bytes read)
0.003035 0.000001 ---> read in readn start
0.003117 0.000082 IP 192.168.10.17.24 > 192.168.10.216.50166: Flags [.], seq 287621:302221, ack 1, win 62615, length 14600
0.003128 0.000011 IP 192.168.10.216.50166 > 192.168.10.17.24: Flags [.], ack 302221, win 65535, length 0
0.003158 0.000030 ---> read in readn done (14600 bytes read)
0.003159 0.000001 ---> read in readn start
0.003240 0.000081 IP 192.168.10.17.24 > 192.168.10.216.50166: Flags [.], seq 302221:316821, ack 1, win 62615, length 14600
0.003252 0.000012 IP 192.168.10.216.50166 > 192.168.10.17.24: Flags [.], ack 316821, win 65535, length 0
0.003279 0.000027 ---> read in readn done (14600 bytes read)
0.003280 0.000001 ---> read in readn start
0.003363 0.000083 IP 192.168.10.17.24 > 192.168.10.216.50166: Flags [.], seq 316821:331421, ack 1, win 62615, length 14600
0.003379 0.000016 IP 192.168.10.216.50166 > 192.168.10.17.24: Flags [.], ack 331421, win 65535, length 0
0.003406 0.000027 ---> read in readn done (14600 bytes read)
0.003407 0.000001 ---> read in readn start
0.003506 0.000099 IP 192.168.10.17.24 > 192.168.10.216.50166: Flags [.], seq 331421:347481, ack 1, win 62615, length 16060
0.003522 0.000016 IP 192.168.10.216.50166 > 192.168.10.17.24: Flags [.], ack 347481, win 65535, length 0
0.003555 0.000033 ---> read in readn done (16060 bytes read)
0.003556 0.000001 ---> read in readn start
0.003594 0.000038 IP 192.168.10.17.24 > 192.168.10.216.50166: Flags [.], seq 347481:359161, ack 1, win 62615, length 11680
0.003609 0.000015 IP 192.168.10.216.50166 > 192.168.10.17.24: Flags [.], ack 359161, win 65535, length 0
0.003639 0.000030 ---> read in readn done (11680 bytes read)
0.003640 0.000001 ---> read in readn start
0.003723 0.000083 IP 192.168.10.17.24 > 192.168.10.216.50166: Flags [.], seq 359161:373761, ack 1, win 62615, length 14600
0.003738 0.000015 IP 192.168.10.216.50166 > 192.168.10.17.24: Flags [.], ack 373761, win 65535, length 0
0.003769 0.000031 ---> read in readn done (14600 bytes read)
0.003770 0.000001 ---> read in readn start
0.003835 0.000065 IP 192.168.10.17.24 > 192.168.10.216.50166: Flags [.], seq 373761:386901, ack 1, win 62615, length 13140
0.003849 0.000014 IP 192.168.10.216.50166 > 192.168.10.17.24: Flags [.], ack 386901, win 65535, length 0
0.003876 0.000027 ---> read in readn done (13140 bytes read)
0.003877 0.000001 ---> read in readn start
0.003957 0.000080 IP 192.168.10.17.24 > 192.168.10.216.50166: Flags [.], seq 386901:401501, ack 1, win 62615, length 14600
0.003972 0.000015 IP 192.168.10.216.50166 > 192.168.10.17.24: Flags [.], ack 401501, win 65535, length 0
0.004003 0.000031 ---> read in readn done (14600 bytes read)
0.004004 0.000001 ---> read in readn start
0.004080 0.000076 IP 192.168.10.17.24 > 192.168.10.216.50166: Flags [.], seq 401501:416101, ack 1, win 62615, length 14600
0.004096 0.000016 IP 192.168.10.216.50166 > 192.168.10.17.24: Flags [.], ack 416101, win 65535, length 0
0.004126 0.000030 ---> read in readn done (14600 bytes read)
0.004126 0.000000 ---> read in readn start
0.004196 0.000070 IP 192.168.10.17.24 > 192.168.10.216.50166: Flags [.], seq 416101:430701, ack 1, win 62615, length 14600
0.004211 0.000015 IP 192.168.10.216.50166 > 192.168.10.17.24: Flags [.], ack 430701, win 65535, length 0
0.004241 0.000030 ---> read in readn done (14600 bytes read)
0.004242 0.000001 ---> read in readn start
0.004321 0.000079 IP 192.168.10.17.24 > 192.168.10.216.50166: Flags [.], seq 430701:445301, ack 1, win 62615, length 14600
0.004336 0.000015 IP 192.168.10.216.50166 > 192.168.10.17.24: Flags [.], ack 445301, win 65535, length 0
0.004363 0.000027 ---> read in readn done (14600 bytes read)
0.004364 0.000001 ---> read in readn start
0.004442 0.000078 IP 192.168.10.17.24 > 192.168.10.216.50166: Flags [.], seq 445301:459901, ack 1, win 62615, length 14600
0.004459 0.000017 IP 192.168.10.216.50166 > 192.168.10.17.24: Flags [.], ack 459901, win 65535, length 0
0.004489 0.000030 ---> read in readn done (14600 bytes read)
0.004490 0.000001 ---> read in readn start
0.004553 0.000063 IP 192.168.10.17.24 > 192.168.10.216.50166: Flags [.], seq 459901:473041, ack 1, win 62615, length 13140
0.004567 0.000014 IP 192.168.10.216.50166 > 192.168.10.17.24: Flags [.], ack 473041, win 65535, length 0
0.004593 0.000026 ---> read in readn done (13140 bytes read)
0.004594 0.000001 ---> read in readn start
0.004677 0.000083 IP 192.168.10.17.24 > 192.168.10.216.50166: Flags [.], seq 473041:487641, ack 1, win 62615, length 14600
0.004691 0.000014 IP 192.168.10.216.50166 > 192.168.10.17.24: Flags [.], ack 487641, win 65535, length 0
0.004725 0.000034 ---> read in readn done (14600 bytes read)
0.004726 0.000001 ---> read in readn start
0.004793 0.000067 IP 192.168.10.17.24 > 192.168.10.216.50166: Flags [.], seq 487641:500781, ack 1, win 62615, length 13140
0.004810 0.000017 IP 192.168.10.216.50166 > 192.168.10.17.24: Flags [.], ack 500781, win 65535, length 0
0.004837 0.000027 ---> read in readn done (13140 bytes read)
0.004838 0.000001 ---> read in readn start
0.004924 0.000086 IP 192.168.10.17.24 > 192.168.10.216.50166: Flags [.], seq 500781:516841, ack 1, win 62615, length 16060
0.004939 0.000015 IP 192.168.10.216.50166 > 192.168.10.17.24: Flags [.], ack 516841, win 65535, length 0
0.004983 0.000044 ---> read in readn done (16060 bytes read)
0.004984 0.000001 ---> read in readn start
0.005031 0.000047 IP 192.168.10.17.24 > 192.168.10.216.50166: Flags [.], seq 516841:529981, ack 1, win 62615, length 13140
0.005046 0.000015 IP 192.168.10.216.50166 > 192.168.10.17.24: Flags [.], ack 529981, win 65535, length 0
0.005071 0.000025 ---> read in readn done (13140 bytes read)
0.005072 0.000001 ---> read in readn start
0.005155 0.000083 IP 192.168.10.17.24 > 192.168.10.216.50166: Flags [.], seq 529981:544581, ack 1, win 62615, length 14600
0.005169 0.000014 IP 192.168.10.216.50166 > 192.168.10.17.24: Flags [.], ack 544581, win 65535, length 0
0.005199 0.000030 ---> read in readn done (14600 bytes read)
0.005200 0.000001 ---> read in readn start
0.005279 0.000079 IP 192.168.10.17.24 > 192.168.10.216.50166: Flags [.], seq 544581:559181, ack 1, win 62615, length 14600
0.005302 0.000023 IP 192.168.10.216.50166 > 192.168.10.17.24: Flags [.], ack 559181, win 65535, length 0
0.005332 0.000030 ---> read in readn done (14600 bytes read)
0.005333 0.000001 ---> read in readn start
0.005392 0.000059 IP 192.168.10.17.24 > 192.168.10.216.50166: Flags [.], seq 559181:572321, ack 1, win 62615, length 13140
0.005407 0.000015 IP 192.168.10.216.50166 > 192.168.10.17.24: Flags [.], ack 572321, win 65535, length 0
0.005434 0.000027 ---> read in readn done (13140 bytes read)
0.005435 0.000001 ---> read in readn start
0.005514 0.000079 IP 192.168.10.17.24 > 192.168.10.216.50166: Flags [.], seq 572321:586921, ack 1, win 62615, length 14600
0.005529 0.000015 IP 192.168.10.216.50166 > 192.168.10.17.24: Flags [.], ack 586921, win 65535, length 0
0.005559 0.000030 ---> read in readn done (14600 bytes read)
0.005560 0.000001 ---> read in readn start
0.005638 0.000078 IP 192.168.10.17.24 > 192.168.10.216.50166: Flags [.], seq 586921:601521, ack 1, win 62615, length 14600
0.005653 0.000015 IP 192.168.10.216.50166 > 192.168.10.17.24: Flags [.], ack 601521, win 65535, length 0
0.005683 0.000030 ---> read in readn done (14600 bytes read)
0.005752 0.000069 IP 192.168.10.17.24 > 192.168.10.216.50166: Flags [.], seq 601521:614661, ack 1, win 62615, length 13140
0.005766 0.000014 IP 192.168.10.216.50166 > 192.168.10.17.24: Flags [.], ack 614661, win 65535, length 0
0.005873 0.000107 IP 192.168.10.17.24 > 192.168.10.216.50166: Flags [.], seq 614661:629261, ack 1, win 62615, length 14600
0.005888 0.000015 IP 192.168.10.216.50166 > 192.168.10.17.24: Flags [.], ack 629261, win 65535, length 0
0.005991 0.000103 IP 192.168.10.17.24 > 192.168.10.216.50166: Flags [.], seq 629261:643861, ack 1, win 62615, length 14600
0.006003 0.000012 IP 192.168.10.216.50166 > 192.168.10.17.24: Flags [.], ack 643861, win 65535, length 0
0.006092 0.000089 ---> read in readn start
0.006116 0.000024 IP 192.168.10.17.24 > 192.168.10.216.50166: Flags [.], seq 643861:658461, ack 1, win 62615, length 14600
0.006198 0.000082 IP 192.168.10.216.50166 > 192.168.10.17.24: Flags [.], ack 658461, win 65535, length 0
0.006232 0.000034 IP 192.168.10.17.24 > 192.168.10.216.50166: Flags [.], seq 658461:671601, ack 1, win 62615, length 13140
0.006249 0.000017 IP 192.168.10.216.50166 > 192.168.10.17.24: Flags [.], ack 671601, win 65535, length 0
0.006273 0.000024 ---> read in readn done (70080 bytes read)
0.006275 0.000002 ---> read in readn start
0.006379 0.000104 IP 192.168.10.17.24 > 192.168.10.216.50166: Flags [.], seq 671601:687661, ack 1, win 62615, length 16060
0.006403 0.000024 IP 192.168.10.216.50166 > 192.168.10.17.24: Flags [.], ack 687661, win 65535, length 0
0.006435 0.000032 ---> read in readn done (16060 bytes read)
0.006436 0.000001 ---> read in readn start
0.006476 0.000040 IP 192.168.10.17.24 > 192.168.10.216.50166: Flags [.], seq 687661:699341, ack 1, win 62615, length 11680
0.006492 0.000016 IP 192.168.10.216.50166 > 192.168.10.17.24: Flags [.], ack 699341, win 65535, length 0
0.006517 0.000025 ---> read in readn done (11680 bytes read)
0.006518 0.000001 ---> read in readn start
0.006591 0.000073 IP 192.168.10.17.24 > 192.168.10.216.50166: Flags [.], seq 699341:712481, ack 1, win 62615, length 13140
0.006607 0.000016 IP 192.168.10.216.50166 > 192.168.10.17.24: Flags [.], ack 712481, win 65535, length 0
0.006632 0.000025 ---> read in readn done (13140 bytes read)
0.006633 0.000001 ---> read in readn start
0.006712 0.000079 IP 192.168.10.17.24 > 192.168.10.216.50166: Flags [.], seq 712481:727081, ack 1, win 62615, length 14600
0.006727 0.000015 IP 192.168.10.216.50166 > 192.168.10.17.24: Flags [.], ack 727081, win 65535, length 0
0.006760 0.000033 ---> read in readn done (14600 bytes read)
0.006761 0.000001 ---> read in readn start
0.006836 0.000075 IP 192.168.10.17.24 > 192.168.10.216.50166: Flags [.], seq 727081:741681, ack 1, win 62615, length 14600
0.006851 0.000015 IP 192.168.10.216.50166 > 192.168.10.17.24: Flags [.], ack 741681, win 65535, length 0
0.006881 0.000030 ---> read in readn done (14600 bytes read)
0.006882 0.000001 ---> read in readn start
0.006949 0.000067 IP 192.168.10.17.24 > 192.168.10.216.50166: Flags [.], seq 741681:754821, ack 1, win 62615, length 13140
0.006964 0.000015 IP 192.168.10.216.50166 > 192.168.10.17.24: Flags [.], ack 754821, win 65535, length 0
0.006991 0.000027 ---> read in readn done (13140 bytes read)
0.006992 0.000001 ---> read in readn start
0.007073 0.000081 IP 192.168.10.17.24 > 192.168.10.216.50166: Flags [.], seq 754821:769421, ack 1, win 62615, length 14600
0.007088 0.000015 IP 192.168.10.216.50166 > 192.168.10.17.24: Flags [.], ack 769421, win 65535, length 0
0.007128 0.000040 ---> read in readn done (14600 bytes read)
0.007129 0.000001 ---> read in readn start
0.007191 0.000062 IP 192.168.10.17.24 > 192.168.10.216.50166: Flags [.], seq 769421:784021, ack 1, win 62615, length 14600
0.007206 0.000015 IP 192.168.10.216.50166 > 192.168.10.17.24: Flags [.], ack 784021, win 65535, length 0
0.007240 0.000034 ---> read in readn done (14600 bytes read)
0.007241 0.000001 ---> read in readn start
0.007323 0.000082 IP 192.168.10.17.24 > 192.168.10.216.50166: Flags [.], seq 784021:798621, ack 1, win 62615, length 14600
0.007339 0.000016 IP 192.168.10.216.50166 > 192.168.10.17.24: Flags [.], ack 798621, win 65535, length 0
0.007366 0.000027 ---> read in readn done (14600 bytes read)
0.007367 0.000001 ---> read in readn start
0.007429 0.000062 IP 192.168.10.17.24 > 192.168.10.216.50166: Flags [.], seq 798621:811761, ack 1, win 62615, length 13140
0.007444 0.000015 IP 192.168.10.216.50166 > 192.168.10.17.24: Flags [.], ack 811761, win 65535, length 0
0.007473 0.000029 ---> read in readn done (13140 bytes read)
0.007474 0.000001 ---> read in readn start
0.007551 0.000077 IP 192.168.10.17.24 > 192.168.10.216.50166: Flags [.], seq 811761:826361, ack 1, win 62615, length 14600
0.007566 0.000015 IP 192.168.10.216.50166 > 192.168.10.17.24: Flags [.], ack 826361, win 65535, length 0
0.007592 0.000026 ---> read in readn done (14600 bytes read)
0.007593 0.000001 ---> read in readn start
0.007675 0.000082 IP 192.168.10.17.24 > 192.168.10.216.50166: Flags [.], seq 826361:840961, ack 1, win 62615, length 14600
0.007690 0.000015 IP 192.168.10.216.50166 > 192.168.10.17.24: Flags [.], ack 840961, win 65535, length 0
0.007723 0.000033 ---> read in readn done (14600 bytes read)
0.007723 0.000000 ---> read in readn start
0.007786 0.000063 IP 192.168.10.17.24 > 192.168.10.216.50166: Flags [.], seq 840961:854101, ack 1, win 62615, length 13140
0.007801 0.000015 IP 192.168.10.216.50166 > 192.168.10.17.24: Flags [.], ack 854101, win 65535, length 0
0.007827 0.000026 ---> read in readn done (13140 bytes read)
0.007828 0.000001 ---> read in readn start
0.007911 0.000083 IP 192.168.10.17.24 > 192.168.10.216.50166: Flags [.], seq 854101:868701, ack 1, win 62615, length 14600
0.007927 0.000016 IP 192.168.10.216.50166 > 192.168.10.17.24: Flags [.], ack 868701, win 65535, length 0
0.007958 0.000031 ---> read in readn done (14600 bytes read)
0.007959 0.000001 ---> read in readn start
0.008034 0.000075 IP 192.168.10.17.24 > 192.168.10.216.50166: Flags [.], seq 868701:883301, ack 1, win 62615, length 14600
0.008048 0.000014 IP 192.168.10.216.50166 > 192.168.10.17.24: Flags [.], ack 883301, win 65535, length 0
0.008074 0.000026 ---> read in readn done (14600 bytes read)
0.008075 0.000001 ---> read in readn start
0.008151 0.000076 IP 192.168.10.17.24 > 192.168.10.216.50166: Flags [.], seq 883301:897901, ack 1, win 62615, length 14600
0.008167 0.000016 IP 192.168.10.216.50166 > 192.168.10.17.24: Flags [.], ack 897901, win 65535, length 0
0.008199 0.000032 ---> read in readn done (14600 bytes read)
0.008200 0.000001 ---> read in readn start
0.008268 0.000068 IP 192.168.10.17.24 > 192.168.10.216.50166: Flags [.], seq 897901:911041, ack 1, win 62615, length 13140
0.008282 0.000014 IP 192.168.10.216.50166 > 192.168.10.17.24: Flags [.], ack 911041, win 65535, length 0
0.008320 0.000038 ---> read in readn done (13140 bytes read)
0.008321 0.000001 ---> read in readn start
0.008392 0.000071 IP 192.168.10.17.24 > 192.168.10.216.50166: Flags [.], seq 911041:925641, ack 1, win 62615, length 14600
0.008408 0.000016 IP 192.168.10.216.50166 > 192.168.10.17.24: Flags [.], ack 925641, win 65535, length 0
0.008434 0.000026 ---> read in readn done (14600 bytes read)
0.008435 0.000001 ---> read in readn start
0.008508 0.000073 IP 192.168.10.17.24 > 192.168.10.216.50166: Flags [.], seq 925641:940241, ack 1, win 62615, length 14600
0.008524 0.000016 IP 192.168.10.216.50166 > 192.168.10.17.24: Flags [.], ack 940241, win 65535, length 0
0.008553 0.000029 ---> read in readn done (14600 bytes read)
0.008554 0.000001 ---> read in readn start
0.008630 0.000076 IP 192.168.10.17.24 > 192.168.10.216.50166: Flags [.], seq 940241:954841, ack 1, win 62615, length 14600
0.008644 0.000014 IP 192.168.10.216.50166 > 192.168.10.17.24: Flags [.], ack 954841, win 65535, length 0
0.008674 0.000030 ---> read in readn done (14600 bytes read)
0.008675 0.000001 ---> read in readn start
0.008747 0.000072 IP 192.168.10.17.24 > 192.168.10.216.50166: Flags [.], seq 954841:967981, ack 1, win 62615, length 13140
0.008761 0.000014 IP 192.168.10.216.50166 > 192.168.10.17.24: Flags [.], ack 967981, win 65535, length 0
0.008791 0.000030 ---> read in readn done (13140 bytes read)
0.008792 0.000001 ---> read in readn start
0.008875 0.000083 IP 192.168.10.17.24 > 192.168.10.216.50166: Flags [.], seq 967981:984041, ack 1, win 62615, length 16060
0.008889 0.000014 IP 192.168.10.216.50166 > 192.168.10.17.24: Flags [.], ack 984041, win 65535, length 0
0.008920 0.000031 ---> read in readn done (16060 bytes read)
0.008920 0.000000 ---> read in readn start
0.008987 0.000067 IP 192.168.10.17.24 > 192.168.10.216.50166: Flags [.], seq 984041:997181, ack 1, win 62615, length 13140
0.009002 0.000015 IP 192.168.10.216.50166 > 192.168.10.17.24: Flags [.], ack 997181, win 65535, length 0
0.009027 0.000025 ---> read in readn done (13140 bytes read)
0.009028 0.000001 ---> read in readn start
0.009127 0.000099 IP 192.168.10.17.24 > 192.168.10.216.50166: Flags [.], seq 997181:1013241, ack 1, win 62615, length 16060
0.009142 0.000015 IP 192.168.10.216.50166 > 192.168.10.17.24: Flags [.], ack 1013241, win 65535, length 0
0.009172 0.000030 ---> read in readn done (16060 bytes read)
0.009173 0.000001 ---> read in readn start
0.009227 0.000054 IP 192.168.10.17.24 > 192.168.10.216.50166: Flags [.], seq 1013241:1024921, ack 1, win 62615, length 11680
0.009242 0.000015 IP 192.168.10.216.50166 > 192.168.10.17.24: Flags [.], ack 1024921, win 65535, length 0
0.009284 0.000042 ---> read in readn done (11680 bytes read)
0.009284 0.000000 ---> read in readn start
0.009348 0.000064 IP 192.168.10.17.24 > 192.168.10.216.50166: Flags [.], seq 1024921:1039521, ack 1, win 62615, length 14600
0.009364 0.000016 IP 192.168.10.216.50166 > 192.168.10.17.24: Flags [.], ack 1039521, win 65535, length 0
0.009390 0.000026 ---> read in readn done (14600 bytes read)
0.009391 0.000001 ---> read in readn start
0.009467 0.000076 IP 192.168.10.17.24 > 192.168.10.216.50166: Flags [.], seq 1039521:1054121, ack 1, win 62615, length 14600
0.009482 0.000015 IP 192.168.10.216.50166 > 192.168.10.17.24: Flags [.], ack 1054121, win 65535, length 0
0.009506 0.000024 ---> read in readn done (9056 bytes read)
0.009507 0.000001 readn() done (1048576 bytes) (5544 bytes in rcvbuf)
0.009516 0.000009 now sleeping 300000 usec
0.009590 0.000074 IP 192.168.10.17.24 > 192.168.10.216.50166: Flags [.], seq 1054121:1068721, ack 1, win 62615, length 14600
0.009607 0.000017 IP 192.168.10.216.50166 > 192.168.10.17.24: Flags [.], ack 1068721, win 65535, length 0
0.009702 0.000095 IP 192.168.10.17.24 > 192.168.10.216.50166: Flags [.], seq 1068721:1081861, ack 1, win 62615, length 13140
0.009715 0.000013 IP 192.168.10.216.50166 > 192.168.10.17.24: Flags [.], ack 1081861, win 65535, length 0
0.009826 0.000111 IP 192.168.10.17.24 > 192.168.10.216.50166: Flags [.], seq 1081861:1096461, ack 1, win 62615, length 14600
0.009838 0.000012 IP 192.168.10.216.50166 > 192.168.10.17.24: Flags [.], ack 1096461, win 65535, length 0
0.009944 0.000106 IP 192.168.10.17.24 > 192.168.10.216.50166: Flags [.], seq 1096461:1111061, ack 1, win 62615, length 14600
0.009957 0.000013 IP 192.168.10.216.50166 > 192.168.10.17.24: Flags [.], ack 1111061, win 65535, length 0
0.010068 0.000111 IP 192.168.10.17.24 > 192.168.10.216.50166: Flags [.], seq 1111061:1125661, ack 1, win 62615, length 14600
0.010181 0.000113 IP 192.168.10.17.24 > 192.168.10.216.50166: Flags [.], seq 1125661:1138801, ack 1, win 62615, length 13140
0.010300 0.000119 IP 192.168.10.17.24 > 192.168.10.216.50166: Flags [.], seq 1138801:1143181, ack 1, win 62615, length 4380
0.013645 0.003345 IP 192.168.10.17.24 > 192.168.10.216.50166: Flags [.], seq 1143181:1143797, ack 1, win 62615, length 616
0.050398 0.036753 IP 192.168.10.216.50166 > 192.168.10.17.24: Flags [.], ack 1143797, win 65535, length 0
0.050557 0.000159 IP 192.168.10.17.24 > 192.168.10.216.50166: Flags [none], win 62615, length 0
0.050557 0.000000 IP 192.168.10.17.24 > 192.168.10.216.50166: Flags [.], seq 1143797:1152557, ack 1, win 62615, length 8760
0.050742 0.000185 IP 192.168.10.17.24 > 192.168.10.216.50166: Flags [.], seq 1152557:1174457, ack 1, win 62615, length 21900
0.050774 0.000032 IP 192.168.10.17.24 > 192.168.10.216.50166: Flags [.], seq 1174457:1175917, ack 1, win 62615, length 1460
0.053500 0.002726 IP 192.168.10.17.24 > 192.168.10.216.50166: Flags [.], seq 1175917:1176533, ack 1, win 62615, length 616
0.091294 0.037794 IP 192.168.10.216.50166 > 192.168.10.17.24: Flags [.], ack 1176533, win 65535, length 0
0.091489 0.000195 IP 192.168.10.17.24 > 192.168.10.216.50166: Flags [none], win 62615, length 0
0.091489 0.000000 IP 192.168.10.17.24 > 192.168.10.216.50166: Flags [.], seq 1176533:1189673, ack 1, win 62615, length 13140
0.091701 0.000212 IP 192.168.10.17.24 > 192.168.10.216.50166: Flags [.], seq 1189673:1208653, ack 1, win 62615, length 18980
0.095198 0.003497 IP 192.168.10.17.24 > 192.168.10.216.50166: Flags [.], seq 1208653:1209269, ack 1, win 62615, length 616
0.132289 0.037091 IP 192.168.10.216.50166 > 192.168.10.17.24: Flags [.], ack 1209269, win 65535, length 0
0.132474 0.000185 IP 192.168.10.17.24 > 192.168.10.216.50166: Flags [none], win 62615, length 0
0.132474 0.000000 IP 192.168.10.17.24 > 192.168.10.216.50166: Flags [.], seq 1209269:1222409, ack 1, win 62615, length 13140
0.132686 0.000212 IP 192.168.10.17.24 > 192.168.10.216.50166: Flags [.], seq 1222409:1241389, ack 1, win 62615, length 18980
0.135936 0.003250 IP 192.168.10.17.24 > 192.168.10.216.50166: Flags [.], seq 1241389:1242005, ack 1, win 62615, length 616
0.173289 0.037353 IP 192.168.10.216.50166 > 192.168.10.17.24: Flags [.], ack 1242005, win 65535, length 0
0.173448 0.000159 IP 192.168.10.17.24 > 192.168.10.216.50166: Flags [none], win 62615, length 0
0.173448 0.000000 IP 192.168.10.17.24 > 192.168.10.216.50166: Flags [.], seq 1242005:1252225, ack 1, win 62615, length 10220
0.173652 0.000204 IP 192.168.10.17.24 > 192.168.10.216.50166: Flags [.], seq 1252225:1274125, ack 1, win 62615, length 21900
0.176642 0.002990 IP 192.168.10.17.24 > 192.168.10.216.50166: Flags [.], seq 1274125:1274741, ack 1, win 62615, length 616
0.214289 0.037647 IP 192.168.10.216.50166 > 192.168.10.17.24: Flags [.], ack 1274741, win 65535, length 0
0.214544 0.000255 IP 192.168.10.17.24 > 192.168.10.216.50166: Flags [none], win 62615, length 0
0.214545 0.000001 IP 192.168.10.17.24 > 192.168.10.216.50166: Flags [.], seq 1274741:1295181, ack 1, win 62615, length 20440
0.214752 0.000207 IP 192.168.10.17.24 > 192.168.10.216.50166: Flags [.], seq 1295181:1306861, ack 1, win 62615, length 11680
0.217404 0.002652 IP 192.168.10.17.24 > 192.168.10.216.50166: Flags [.], seq 1306861:1307477, ack 1, win 62615, length 616
0.255289 0.037885 IP 192.168.10.216.50166 > 192.168.10.17.24: Flags [.], ack 1307477, win 65535, length 0
0.255515 0.000226 IP 192.168.10.17.24 > 192.168.10.216.50166: Flags [.], seq 1307477:1324997, ack 1, win 62615, length 17520
0.255729 0.000214 IP 192.168.10.17.24 > 192.168.10.216.50166: Flags [.], seq 1324997:1339597, ack 1, win 62615, length 14600
0.258978 0.003249 IP 192.168.10.17.24 > 192.168.10.216.50166: Flags [.], seq 1339597:1340213, ack 1, win 62615, length 616
0.296289 0.037311 IP 192.168.10.216.50166 > 192.168.10.17.24: Flags [.], ack 1340213, win 65535, length 0
0.296488 0.000199 IP 192.168.10.17.24 > 192.168.10.216.50166: Flags [none], win 62615, length 0
0.296488 0.000000 IP 192.168.10.17.24 > 192.168.10.216.50166: Flags [.], seq 1340213:1354813, ack 1, win 62615, length 14600
0.296700 0.000212 IP 192.168.10.17.24 > 192.168.10.216.50166: Flags [.], seq 1354813:1372333, ack 1, win 62615, length 17520
0.299720 0.003020 IP 192.168.10.17.24 > 192.168.10.216.50166: Flags [.], seq 1372333:1372949, ack 1, win 62615, length 616
0.309518 0.009798 readn() start (324372 bytes in rcvbuf)
0.309523 0.000005 ---> read in readn start
0.309584 0.000061 IP 192.168.10.216.50166 > 192.168.10.17.24: Flags [.], ack 1372949, win 65535, length 0
0.309586 0.000002 ---> read in readn done (324372 bytes read)
0.309586 0.000000 ---> read in readn start
0.309910 0.000324 IP 192.168.10.17.24 > 192.168.10.216.50166: Flags [none], win 62615, length 0
0.309910 0.000000 IP 192.168.10.17.24 > 192.168.10.216.50166: Flags [.], seq 1372949:1403609, ack 1, win 62615, length 30660
0.310035 0.000125 IP 192.168.10.216.50166 > 192.168.10.17.24: Flags [.], ack 1403609, win 65535, length 0
0.310041 0.000006 ---> read in readn done (30660 bytes read)
0.310042 0.000001 ---> read in readn start
0.310117 0.000075 IP 192.168.10.17.24 > 192.168.10.216.50166: Flags [.], seq 1403609:1406529, ack 1, win 62615, length 2920
0.310136 0.000019 IP 192.168.10.216.50166 > 192.168.10.17.24: Flags [.], ack 1406529, win 65535, length 0
0.310177 0.000041 ---> read in readn done (2920 bytes read)
0.310178 0.000001 ---> read in readn start
0.310224 0.000046 IP 192.168.10.17.24 > 192.168.10.216.50166: Flags [.], seq 1406529:1419669, ack 1, win 62615, length 13140
0.310280 0.000056 IP 192.168.10.216.50166 > 192.168.10.17.24: Flags [.], ack 1419669, win 65535, length 0
0.310285 0.000005 ---> read in readn done (13140 bytes read)
0.310286 0.000001 ---> read in readn start
0.310317 0.000031 IP 192.168.10.17.24 > 192.168.10.216.50166: Flags [.], seq 1419669:1431349, ack 1, win 62615, length 11680
0.310327 0.000010 IP 192.168.10.216.50166 > 192.168.10.17.24: Flags [.], ack 1431349, win 65535, length 0
0.310381 0.000054 ---> read in readn done (11680 bytes read)
0.310382 0.000001 ---> read in readn start
0.310446 0.000064 IP 192.168.10.17.24 > 192.168.10.216.50166: Flags [.], seq 1431349:1445949, ack 1, win 62615, length 14600
0.310456 0.000010 IP 192.168.10.216.50166 > 192.168.10.17.24: Flags [.], ack 1445949, win 65535, length 0
0.310499 0.000043 ---> read in readn done (14600 bytes read)
0.310500 0.000001 ---> read in readn start
0.310556 0.000056 IP 192.168.10.17.24 > 192.168.10.216.50166: Flags [.], seq 1445949:1459089, ack 1, win 62615, length 13140
0.310566 0.000010 IP 192.168.10.216.50166 > 192.168.10.17.24: Flags [.], ack 1459089, win 65535, length 0
0.310610 0.000044 ---> read in readn done (13140 bytes read)
0.310611 0.000001 ---> read in readn start
0.310688 0.000077 IP 192.168.10.17.24 > 192.168.10.216.50166: Flags [.], seq 1459089:1475149, ack 1, win 62615, length 16060
0.310698 0.000010 IP 192.168.10.216.50166 > 192.168.10.17.24: Flags [.], ack 1475149, win 65535, length 0
0.310744 0.000046 ---> read in readn done (16060 bytes read)
0.310745 0.000001 ---> read in readn start
0.310795 0.000050 IP 192.168.10.17.24 > 192.168.10.216.50166: Flags [.], seq 1475149:1488289, ack 1, win 62615, length 13140
0.310804 0.000009 IP 192.168.10.216.50166 > 192.168.10.17.24: Flags [.], ack 1488289, win 65535, length 0
0.310808 0.000004 ---> read in readn done (13140 bytes read)
0.310808 0.000000 ---> read in readn start
0.310912 0.000104 IP 192.168.10.17.24 > 192.168.10.216.50166: Flags [.], seq 1488289:1501429, ack 1, win 62615, length 13140
0.310922 0.000010 IP 192.168.10.216.50166 > 192.168.10.17.24: Flags [.], ack 1501429, win 65535, length 0
0.310926 0.000004 ---> read in readn done (13140 bytes read)
0.310938 0.000012 ---> read in readn start
0.311035 0.000097 IP 192.168.10.17.24 > 192.168.10.216.50166: Flags [.], seq 1501429:1516029, ack 1, win 62615, length 14600
0.311045 0.000010 IP 192.168.10.216.50166 > 192.168.10.17.24: Flags [.], ack 1516029, win 65535, length 0
0.311049 0.000004 ---> read in readn done (14600 bytes read)
0.311049 0.000000 ---> read in readn start
0.311120 0.000071 IP 192.168.10.17.24 > 192.168.10.216.50166: Flags [.], seq 1516029:1526249, ack 1, win 62615, length 10220
0.311124 0.000004 IP 192.168.10.216.50166 > 192.168.10.17.24: Flags [.], ack 1526249, win 65535, length 0
0.311127 0.000003 ---> read in readn done (10220 bytes read)
0.311128 0.000001 ---> read in readn start
0.311241 0.000113 IP 192.168.10.17.24 > 192.168.10.216.50166: Flags [.], seq 1526249:1540849, ack 1, win 62615, length 14600
0.311244 0.000003 IP 192.168.10.216.50166 > 192.168.10.17.24: Flags [.], ack 1540849, win 65535, length 0
0.311247 0.000003 ---> read in readn done (14600 bytes read)
0.311248 0.000001 ---> read in readn start
0.311364 0.000116 IP 192.168.10.17.24 > 192.168.10.216.50166: Flags [.], seq 1540849:1555449, ack 1, win 62615, length 14600
0.311367 0.000003 IP 192.168.10.216.50166 > 192.168.10.17.24: Flags [.], ack 1555449, win 65535, length 0
0.311370 0.000003 ---> read in readn done (14600 bytes read)
0.311370 0.000000 ---> read in readn start
0.311480 0.000110 IP 192.168.10.17.24 > 192.168.10.216.50166: Flags [.], seq 1555449:1568589, ack 1, win 62615, length 13140
0.311483 0.000003 IP 192.168.10.216.50166 > 192.168.10.17.24: Flags [.], ack 1568589, win 65535, length 0
0.311486 0.000003 ---> read in readn done (13140 bytes read)
0.311486 0.000000 ---> read in readn start
0.311600 0.000114 IP 192.168.10.17.24 > 192.168.10.216.50166: Flags [.], seq 1568589:1583189, ack 1, win 62615, length 14600
0.311603 0.000003 IP 192.168.10.216.50166 > 192.168.10.17.24: Flags [.], ack 1583189, win 65535, length 0
0.311607 0.000004 ---> read in readn done (14600 bytes read)
0.311607 0.000000 ---> read in readn start
0.311720 0.000113 IP 192.168.10.17.24 > 192.168.10.216.50166: Flags [.], seq 1583189:1597789, ack 1, win 62615, length 14600
0.311723 0.000003 IP 192.168.10.216.50166 > 192.168.10.17.24: Flags [.], ack 1597789, win 65535, length 0
0.311726 0.000003 ---> read in readn done (14600 bytes read)
0.311726 0.000000 ---> read in readn start
0.311840 0.000114 IP 192.168.10.17.24 > 192.168.10.216.50166: Flags [.], seq 1597789:1612389, ack 1, win 62615, length 14600
0.311842 0.000002 IP 192.168.10.216.50166 > 192.168.10.17.24: Flags [.], ack 1612389, win 65535, length 0
0.311846 0.000004 ---> read in readn done (14600 bytes read)
0.311846 0.000000 ---> read in readn start
0.311959 0.000113 IP 192.168.10.17.24 > 192.168.10.216.50166: Flags [.], seq 1612389:1625529, ack 1, win 62615, length 13140
0.311962 0.000003 IP 192.168.10.216.50166 > 192.168.10.17.24: Flags [.], ack 1625529, win 65535, length 0
0.311965 0.000003 ---> read in readn done (13140 bytes read)
0.311965 0.000000 ---> read in readn start
0.312080 0.000115 IP 192.168.10.17.24 > 192.168.10.216.50166: Flags [.], seq 1625529:1640129, ack 1, win 62615, length 14600
0.312083 0.000003 IP 192.168.10.216.50166 > 192.168.10.17.24: Flags [.], ack 1640129, win 65535, length 0
0.312086 0.000003 ---> read in readn done (14600 bytes read)
0.312086 0.000000 ---> read in readn start
0.312200 0.000114 IP 192.168.10.17.24 > 192.168.10.216.50166: Flags [.], seq 1640129:1654729, ack 1, win 62615, length 14600
0.312203 0.000003 IP 192.168.10.216.50166 > 192.168.10.17.24: Flags [.], ack 1654729, win 65535, length 0
0.312206 0.000003 ---> read in readn done (14600 bytes read)
0.312206 0.000000 ---> read in readn start
0.312319 0.000113 IP 192.168.10.17.24 > 192.168.10.216.50166: Flags [.], seq 1654729:1667869, ack 1, win 62615, length 13140
0.312322 0.000003 IP 192.168.10.216.50166 > 192.168.10.17.24: Flags [.], ack 1667869, win 65535, length 0
0.312325 0.000003 ---> read in readn done (13140 bytes read)
0.312325 0.000000 ---> read in readn start
0.312437 0.000112 IP 192.168.10.17.24 > 192.168.10.216.50166: Flags [.], seq 1667869:1682469, ack 1, win 62615, length 14600
0.312440 0.000003 IP 192.168.10.216.50166 > 192.168.10.17.24: Flags [.], ack 1682469, win 65535, length 0
0.312443 0.000003 ---> read in readn done (14600 bytes read)
0.312443 0.000000 ---> read in readn start
0.312560 0.000117 IP 192.168.10.17.24 > 192.168.10.216.50166: Flags [.], seq 1682469:1697069, ack 1, win 62615, length 14600
0.312563 0.000003 IP 192.168.10.216.50166 > 192.168.10.17.24: Flags [.], ack 1697069, win 65535, length 0
0.312566 0.000003 ---> read in readn done (14600 bytes read)
0.312566 0.000000 ---> read in readn start
0.312685 0.000119 IP 192.168.10.17.24 > 192.168.10.216.50166: Flags [.], seq 1697069:1711669, ack 1, win 62615, length 14600
0.312688 0.000003 IP 192.168.10.216.50166 > 192.168.10.17.24: Flags [.], ack 1711669, win 65535, length 0
0.312691 0.000003 ---> read in readn done (14600 bytes read)
0.312691 0.000000 ---> read in readn start
0.312798 0.000107 IP 192.168.10.17.24 > 192.168.10.216.50166: Flags [.], seq 1711669:1724809, ack 1, win 62615, length 13140
0.312800 0.000002 IP 192.168.10.216.50166 > 192.168.10.17.24: Flags [.], ack 1724809, win 65535, length 0
0.312803 0.000003 ---> read in readn done (13140 bytes read)
0.312803 0.000000 ---> read in readn start
0.312919 0.000116 IP 192.168.10.17.24 > 192.168.10.216.50166: Flags [.], seq 1724809:1739409, ack 1, win 62615, length 14600
0.312922 0.000003 IP 192.168.10.216.50166 > 192.168.10.17.24: Flags [.], ack 1739409, win 65535, length 0
0.312925 0.000003 ---> read in readn done (14600 bytes read)
0.312925 0.000000 ---> read in readn start
0.313038 0.000113 IP 192.168.10.17.24 > 192.168.10.216.50166: Flags [.], seq 1739409:1754009, ack 1, win 62615, length 14600
0.313040 0.000002 IP 192.168.10.216.50166 > 192.168.10.17.24: Flags [.], ack 1754009, win 65535, length 0
0.313043 0.000003 ---> read in readn done (14600 bytes read)
0.313044 0.000001 ---> read in readn start
0.313158 0.000114 IP 192.168.10.17.24 > 192.168.10.216.50166: Flags [.], seq 1754009:1768609, ack 1, win 62615, length 14600
0.313161 0.000003 IP 192.168.10.216.50166 > 192.168.10.17.24: Flags [.], ack 1768609, win 65535, length 0
0.313164 0.000003 ---> read in readn done (14600 bytes read)
0.313164 0.000000 ---> read in readn start
0.313281 0.000117 IP 192.168.10.17.24 > 192.168.10.216.50166: Flags [.], seq 1768609:1783209, ack 1, win 62615, length 14600
0.313284 0.000003 IP 192.168.10.216.50166 > 192.168.10.17.24: Flags [.], ack 1783209, win 65535, length 0
0.313289 0.000005 ---> read in readn done (14600 bytes read)
0.313290 0.000001 ---> read in readn start
